Name,Age,Sex,Python_score,Education_level,Education,Faculty,Years_experience,image,Text1,Text2
Robert Watkins,54,nonbinary,41,bachelor,Computer Scientist,sciences,4,download.jpg,selection banana banana cool random of a random banana random ,cool yay words yay words this yay banana a is yay random a this hello of of banana banana is 
Mary Johnson,29,nonbinary,97,masters,Information Sciences,engineering,24,download3.jpg,a a hello random a random yay this of is ,of selection selection banana is hello words of selection banana words selection cool a random a hello hello random this 
Amanda Sigman,18,nonbinary,69,high school,Journalist,sciences,30,download1.jpg,a is is cool hello of yay words a this ,cool of hello selection cool hello of yay a words random of of of a words of banana cool is 
Audrey Petty,50,prefer not to say,53,masters,Information Sciences,sciences,50,download3.jpg,of cool random cool banana selection this a random hello ,this yay yay a words a is is yay hello words selection selection words words random this cool of words 
Jacob Penick,58,prefer not to say,63,bachelor,Media Science,arts,49,download2.jpg,a yay random is hello this selection selection cool a ,banana a of cool is of cool selection this a this selection yay random yay is cool random this selection 
Stacy Chapman,27,male,31,high school,Media Science,sciences,13,download.jpg,yay random this hello is hello selection this a this ,this yay cool this cool words yay a a a a selection is cool hello banana hello cool words cool 
Jack Grigsby,30,female,79,phd,Information Sciences,sciences,9,download1.jpg,cool cool hello cool hello selection selection this hello of ,banana hello selection yay words yay banana random yay is of banana this a this of of this cool cool 
James Lacount,53,male,63,bachelor,Media Science,sciences,2,download1.jpg,is banana of hello is of hello hello a selection ,random of is is hello words words this this this this words yay of this random is random this yay 
Donna Clasen,24,nonbinary,60,phd,Journalist,arts,45,download3.jpg,selection is is selection is hello cool is words is ,cool a yay a this banana yay banana selection is yay words words random words cool cool yay banana selection 
Nancy Ritzman,25,female,30,bachelor,Cognitive Science,sciences,42,download1.jpg,a of cool hello hello this is this banana of ,selection selection cool banana hello selection words hello a a cool random yay banana selection banana this this a banana 
Elsie Miller,32,male,22,phd,Cognitive Science,engineering,8,download.jpg,cool yay this a hello hello words hello selection is ,random of is words a yay random hello words is hello this a banana banana yay selection banana hello of 
Janice Tolson,46,female,12,masters,Cognitive Science,arts,43,download.jpg,words banana selection of random of is selection is yay ,hello hello yay is hello cool banana hello hello words is hello selection is this of words yay a banana 
Jennifer Lee,26,male,13,masters,Computer Scientist,sciences,11,download3.jpg,cool is banana is this a banana banana random this ,this yay of banana this random selection cool words selection of hello cool a cool of is a cool selection 
Gary Fields,64,female,5,phd,Journalist,sciences,41,download.jpg,banana this selection a random this banana of banana banana ,a is a hello hello a words hello is selection a is hello selection cool banana banana hello cool of 
Margaret Green,51,prefer not to say,16,bachelor,Cognitive Science,arts,14,download.jpg,yay of of yay selection yay yay this is yay ,this selection cool words of of words selection yay this selection yay selection a words banana words banana is of 
Frances Vandyke,36,female,57,masters,Computer Scientist,engineering,15,download1.jpg,a of of hello hello random cool a a random ,banana yay hello banana words yay words yay selection this yay selection yay banana of of cool cool is selection 
Iona Hall,28,nonbinary,4,high school,Media Science,sciences,27,download.jpg,random this banana selection banana words is a is this ,random hello yay random of this this random random is hello yay banana of selection a is cool selection selection 
George Carnillo,44,female,93,masters,Computer Scientist,engineering,31,download1.jpg,banana banana yay this words is random a is of ,this cool hello is hello of is random cool is banana words random hello words hello selection hello is is 
Cathy Carlisle,61,nonbinary,56,phd,Software Engineer,arts,20,download.jpg,selection hello selection of words is hello banana words yay ,random selection this this hello cool banana random this banana banana selection yay this cool selection random hello banana a 
Daniel Solares,39,nonbinary,52,bachelor,Cognitive Science,engineering,35,download2.jpg,is of banana words banana banana random random random hello ,cool cool is hello of hello cool hello random is is cool banana hello hello a yay selection words this 
Matilde Woelfel,45,prefer not to say,35,masters,Software Engineer,engineering,46,download1.jpg,is random yay selection is hello yay this words hello ,words banana banana random hello yay this random cool a banana random words banana selection cool cool words selection a 
Richard Gibson,60,prefer not to say,19,bachelor,Software Engineer,arts,32,download.jpg,words selection yay words hello yay selection random of banana ,is hello a words selection of random words hello words selection a yay cool this this selection yay this yay 
Eddie Hills,28,prefer not to say,79,high school,Cognitive Science,arts,12,download3.jpg,hello yay banana cool yay this hello selection cool hello ,a banana hello cool cool a is selection yay yay selection words of banana is is this banana random a 
Cherie Edge,47,male,0,masters,Computer Scientist,engineering,36,download.jpg,yay this random yay is hello cool random cool is ,words cool yay selection hello selection this cool yay random this selection words of hello banana a this banana cool 
Michael Dials,34,female,49,high school,Computer Scientist,arts,31,download.jpg,of is selection words random a of selection cool is ,cool a this banana cool words is banana is a cool words of words hello cool of yay a hello 
Chong Mckane,35,prefer not to say,47,masters,Journalist,arts,3,download1.jpg,of is cool yay hello this cool this hello banana ,words selection a this words banana words words is cool a hello random of is words random words this banana 
George Curran,23,nonbinary,75,bachelor,Computer Scientist,arts,20,download3.jpg,of banana words yay random banana words is is hello ,cool words banana words this cool hello selection random is hello banana this a is hello yay selection is random 
Paul Friedman,45,female,40,masters,Information Sciences,arts,39,download1.jpg,this cool a yay banana words this random is banana ,a this hello selection yay cool of is random selection is words is words random selection yay a selection yay 
Maureen Garrison,44,prefer not to say,10,bachelor,Software Engineer,arts,3,download3.jpg,yay random cool banana of hello selection banana of hello ,a random words random this a a a banana of cool is this hello words banana a is yay this 
Jessica Riggs,29,female,87,phd,Cognitive Science,engineering,23,download.jpg,hello cool cool this of cool cool random this random ,banana of cool cool words of words of this words is words this yay cool is selection yay banana of 
Richard Davis,59,female,52,masters,Journalist,sciences,14,download.jpg,cool random hello selection this of selection banana words of ,hello cool random cool banana is is this banana selection hello yay yay yay words yay is words cool this 
Marc Nowicki,31,male,82,high school,Computer Scientist,engineering,48,download3.jpg,yay words random of is words random selection yay banana ,hello this of yay is yay this this hello yay selection random words a of selection words a this this 
Vicki Cioffi,27,prefer not to say,8,bachelor,Cognitive Science,arts,14,download2.jpg,hello selection words yay is of hello random a a ,of selection is cool is banana hello words is this random hello banana random banana hello is of yay hello 
Indira Weeks,44,male,52,bachelor,Media Science,arts,4,download.jpg,this is random this a this is yay this hello ,random is is banana random yay hello a selection selection of selection random is hello yay cool random banana is 
Michael Armstrong,36,male,68,masters,Journalist,sciences,49,download.jpg,yay is is banana yay is is a is words ,banana words of of hello cool a cool banana cool banana this this banana selection random hello cool a cool 
Salvador Torres,26,male,79,phd,Computer Scientist,sciences,46,download1.jpg,words cool this of is hello words words a random ,of a hello selection random of is yay selection of words yay banana this selection this a of words this 
Jay Tabor,26,prefer not to say,61,bachelor,Media Science,arts,2,download.jpg,banana banana banana hello hello banana hello a words selection ,a random of this random is of cool random yay of cool yay banana is this a this a hello 
