Name,Age,Sex,Python_score,Education_level,Education,Faculty,Years_experience,image,Text1,Text2
Jay Thornhill,50,nonbinary,24,high school,Cognitive Science,engineering,7,download3.jpg,a selection selection cool cool words is is words hello ,is yay is hello words words is yay words random yay banana selection words selection selection of selection of of 
Sheila Boyd,49,prefer not to say,27,high school,Cognitive Science,engineering,26,download.jpg,selection is a of hello selection of yay a is ,is is yay selection words a random is this of a random banana selection a a random a of random 
Florence Painter,53,male,12,bachelor,Computer Scientist,engineering,9,download2.jpg,selection hello banana random hello a words of of banana ,this this a of this this cool is selection cool selection words words words this cool random hello random selection 
Lynda Thibeault,55,nonbinary,18,high school,Software Engineer,sciences,9,download2.jpg,selection words this is cool a cool selection is is ,this is a yay words is is of a random this banana this yay cool words hello of yay banana 
Gloria Jones,22,female,19,bachelor,Computer Scientist,engineering,19,download.jpg,banana of of yay banana words is of words banana ,is a a random selection random random this words of banana banana cool this this selection hello of random of 
Rex Barrington,40,nonbinary,36,high school,Media Science,sciences,31,download3.jpg,random is hello yay of of a yay words random ,words this a is this this words cool random banana this selection banana cool banana is random random banana selection 
Shelli Keeth,53,nonbinary,82,high school,Journalist,sciences,1,download.jpg,of is of selection selection cool random of hello random ,this of of cool random random of of this cool this a random yay this banana selection a a of 
Ethan Lassiter,62,male,72,bachelor,Cognitive Science,sciences,48,download.jpg,this banana banana words is yay cool cool yay a ,is random this hello this banana words yay selection words selection random yay banana a a selection is a of 
Michael Conlisk,25,prefer not to say,88,masters,Journalist,engineering,15,download.jpg,banana cool of is yay this yay cool of selection ,yay cool hello this is a selection random selection banana yay yay words selection hello banana selection cool is banana 
Margaret Frazier,26,male,81,masters,Software Engineer,engineering,35,download2.jpg,a random yay hello hello banana is words selection banana ,is cool banana this hello of cool a hello a is selection cool yay selection selection a words random hello 
Roderick Harrison,51,prefer not to say,29,bachelor,Cognitive Science,sciences,36,download.jpg,random selection cool words banana a a hello of words ,is of selection selection a is selection hello yay hello selection hello is selection banana this hello selection this banana 
Helen Galvan,58,prefer not to say,15,bachelor,Journalist,engineering,19,download1.jpg,is of is cool this of banana of hello random ,random this yay banana of banana of random hello this cool hello of is is yay cool random words a 
Jeremy Mullings,18,male,33,bachelor,Computer Scientist,arts,48,download.jpg,yay yay is this cool hello hello hello cool hello ,is a a hello yay this is cool cool a hello of selection cool is yay random a this words 
Robert Angell,30,male,17,phd,Journalist,sciences,35,download3.jpg,cool cool words yay selection banana is this words cool ,random is hello words hello words of this selection a hello this this a is a banana random selection words 
Rosalie Spence,56,nonbinary,49,masters,Cognitive Science,arts,5,download3.jpg,cool banana selection words of yay a this selection banana ,is of random words banana random this selection a this selection of cool is selection banana yay of is yay 
Larry Barnes,26,female,26,high school,Journalist,sciences,13,download3.jpg,banana yay yay hello words is yay this banana yay ,of hello of selection a yay is banana yay is random random of words is cool is is a random 
Emma Bowman,37,female,85,phd,Computer Scientist,arts,13,download.jpg,cool hello is a a yay is selection this this ,banana hello yay cool selection words yay selection hello random a of selection cool of this a words random hello 
Mary Lozey,30,male,72,masters,Cognitive Science,engineering,12,download.jpg,selection cool random of is a banana selection cool banana ,a a of yay of this hello random random of banana is words cool cool cool is hello selection cool 
Jerold Martino,36,nonbinary,15,phd,Software Engineer,sciences,12,download2.jpg,yay of random cool is a yay cool of is ,cool random banana of is cool is of banana words random hello hello selection hello selection is cool random cool 
Charles Townsend,40,nonbinary,85,phd,Cognitive Science,sciences,49,download1.jpg,cool is yay selection yay cool cool of words words ,of this banana this yay random banana of is selection cool a hello cool hello cool yay banana cool random 
Shawn Taylor,28,male,59,phd,Journalist,arts,46,download1.jpg,cool this of cool random selection banana random random banana ,random selection selection banana a of hello cool selection cool is banana yay this selection hello banana banana hello selection 
Andrew Castillo,62,prefer not to say,61,masters,Software Engineer,sciences,19,download2.jpg,random random words selection selection of is yay is is ,random yay a selection of is random banana yay words selection a selection words hello words words hello words of 
Anthony Larrabee,61,prefer not to say,84,bachelor,Software Engineer,sciences,48,download.jpg,this random banana hello selection cool yay this of hello ,selection of words yay yay banana words random yay random cool hello a cool random this yay words random random 
Michael Dennis,34,female,3,bachelor,Journalist,arts,6,download2.jpg,random a a of is hello of words is random ,of words of of selection banana of banana words of selection a banana words hello hello words cool a random 
Jessie Jones,24,nonbinary,18,masters,Media Science,arts,37,download1.jpg,selection this cool cool selection yay is yay hello of ,banana hello this is this of banana selection hello cool yay words banana banana yay random selection selection cool is 
Sally Smith,56,nonbinary,29,phd,Journalist,arts,9,download3.jpg,selection of random of of selection is cool random words ,banana hello a of banana random a a words cool hello is yay hello random cool yay of a banana 
Sonny Roberts,46,nonbinary,52,bachelor,Information Sciences,arts,10,download1.jpg,yay words this selection of cool random is words selection ,this yay is is yay banana random yay hello a selection hello hello yay of cool cool this of yay 
Donald Cisneros,46,nonbinary,52,masters,Media Science,sciences,3,download1.jpg,of this random hello cool words is a words yay ,words random is cool of is is selection is selection yay a random banana yay is hello hello a words 
Enrique Pena,65,female,43,phd,Cognitive Science,arts,0,download3.jpg,selection this selection a yay selection words words of this ,is random banana cool selection banana of of this random this words selection words words yay selection banana banana a 
Mildred Busch,18,female,8,bachelor,Journalist,engineering,38,download1.jpg,yay this random random selection a hello a cool a ,this is hello words of hello of this cool hello this a selection is words hello this selection of words 
Angela Giles,30,prefer not to say,2,high school,Media Science,arts,15,download2.jpg,banana this selection this is of cool of cool banana ,hello a cool of hello selection yay this banana words random this random is selection random this of cool random 
Theresa Voorhis,26,male,16,phd,Cognitive Science,arts,38,download3.jpg,words selection banana is random yay is a of hello ,selection of words yay banana this banana cool words selection of cool banana banana a words random is a cool 
Kenneth Ault,65,nonbinary,45,high school,Software Engineer,arts,50,download.jpg,this this selection hello random banana of random hello a ,is words banana a words a words selection this this this random is cool this random a of cool words 
Alexandra Riley,63,nonbinary,7,high school,Journalist,arts,30,download3.jpg,banana banana words is yay yay hello hello a hello ,selection selection hello a selection random random yay banana words of random hello of of hello hello a selection of 
Edward Robinson,32,prefer not to say,4,high school,Journalist,sciences,18,download.jpg,selection banana a words selection this cool words banana hello ,hello selection words selection hello cool is of a this random a selection this yay hello yay cool is cool 
Eric Mcclellan,34,nonbinary,21,masters,Cognitive Science,engineering,37,download2.jpg,of selection random words hello banana cool of a random ,selection yay of is yay banana yay this a hello random cool of hello words random cool hello cool banana 
Shannon Graza,49,female,60,high school,Software Engineer,sciences,5,download3.jpg,a of yay of this this hello a cool yay ,this hello random a is banana selection cool hello this words random this yay banana yay words selection cool a 
Michael King,54,female,98,bachelor,Journalist,engineering,23,download1.jpg,hello of selection a of cool random of this yay ,hello banana this is cool a selection a is selection this banana banana banana hello selection yay words of selection 
George Ramaker,32,prefer not to say,92,high school,Media Science,engineering,21,download1.jpg,hello a hello a of this a a of hello ,this yay yay this words a yay hello this random yay hello words banana a a yay is words banana 
Robert Rosario,29,prefer not to say,5,high school,Media Science,engineering,8,download2.jpg,random is a selection of hello cool selection of hello ,hello of hello of hello words hello yay of cool selection is selection is is yay is random of banana 
Craig Holden,65,prefer not to say,55,high school,Cognitive Science,engineering,1,download3.jpg,words is cool of random hello cool words yay a ,this random cool yay words selection random this yay selection of is banana yay random banana this a words banana 
Florence Berkley,44,nonbinary,57,masters,Journalist,arts,50,download3.jpg,yay of this is a of a this selection hello ,words of yay this a words random yay selection random cool a random hello hello cool of random a banana 
Alex Taylor,21,male,30,masters,Computer Scientist,sciences,45,download.jpg,words selection hello banana random random is is is selection ,cool random of is words a a this of random yay a banana banana banana cool banana words words of 
Clare Walshe,30,prefer not to say,67,phd,Media Science,arts,3,download.jpg,cool this words yay is random selection hello of hello ,yay selection this words random hello this of of words of yay words is yay cool of a a selection 
Elsa Lynch,32,prefer not to say,15,masters,Information Sciences,engineering,14,download2.jpg,selection banana this yay hello random random a of random ,yay random a random yay yay cool random selection words words yay words banana selection random selection selection this banana 
Micheal Pierce,23,prefer not to say,91,masters,Software Engineer,sciences,45,download1.jpg,this hello selection cool a yay hello hello of this ,selection words words words random selection hello hello yay is this yay a selection words yay hello is banana words 
Sylvia Coles,21,female,86,masters,Computer Scientist,arts,38,download.jpg,this of banana words yay hello this words selection words ,yay selection yay words yay banana is of random this this yay a banana hello random is a is cool 
John Coutermarsh,62,female,97,phd,Computer Scientist,sciences,49,download.jpg,yay a is is a is banana selection a words ,cool a yay selection a words random random of yay this is banana cool of cool words a words of 
Elizabeth Mangrum,63,prefer not to say,82,bachelor,Software Engineer,engineering,43,download3.jpg,hello selection hello a yay this this yay this hello ,hello hello is is cool is this selection is random this this hello selection selection a this a banana words 
Duane Brady,49,female,42,high school,Information Sciences,engineering,27,download1.jpg,cool selection of yay banana selection banana is of hello ,a a is hello hello random this banana banana selection cool is hello of random of random is yay cool 
Ernest Gaston,53,female,75,masters,Software Engineer,arts,47,download3.jpg,a of a yay hello cool cool selection cool random ,a is is this yay this yay cool this random selection this cool cool this is a cool this a 
William Dickerson,36,male,24,phd,Computer Scientist,engineering,39,download1.jpg,hello is yay this hello is banana yay hello hello ,yay selection cool selection words this banana words of of random of is is hello cool this banana yay cool 
Alan Dorn,40,male,14,high school,Cognitive Science,arts,13,download1.jpg,selection yay a selection words words a a yay is ,cool a banana banana random is a words of cool of random words this banana of this a a of 
Ryan Fuhrman,29,nonbinary,28,bachelor,Cognitive Science,sciences,22,download.jpg,hello this random this selection of of words a this ,banana random of words yay words random yay a cool random is this words selection is banana this this hello 
Juan Demoss,38,female,45,masters,Media Science,engineering,8,download1.jpg,of hello random random this of a of is a ,a hello this hello words selection banana yay random hello yay banana selection yay a this words this is a 
Vincent Thomas,23,male,83,high school,Software Engineer,sciences,4,download3.jpg,banana of a is a a yay words yay selection ,this selection selection selection cool yay this is a of cool cool cool is selection words is banana banana words 
Nancy Lauriano,30,nonbinary,39,high school,Journalist,arts,20,download2.jpg,words is cool random of random yay this a yay ,hello a is yay banana cool this this random hello a cool of words cool banana random banana this a 
Myron Bradberry,27,male,23,masters,Media Science,engineering,30,download3.jpg,cool yay selection of this banana of yay cool random ,words cool selection is of of of of cool a this a hello selection a yay banana words banana random 
William Whalen,19,female,98,masters,Computer Scientist,arts,11,download3.jpg,is hello is banana this words banana words is words ,selection banana banana yay is selection is random this cool hello is yay cool a banana hello a banana is 
Ben Jackson,62,prefer not to say,87,bachelor,Cognitive Science,sciences,20,download1.jpg,of banana of of this yay is words words is ,random cool of random is selection random a this a random cool hello cool this of is yay selection of 
Alexander Samons,29,female,4,high school,Information Sciences,arts,30,download2.jpg,random selection selection a a words random is of of ,random yay of yay banana of is words yay words banana banana a random selection selection of random hello of 
Brandon Biddle,24,prefer not to say,80,bachelor,Journalist,arts,29,download2.jpg,this selection is selection banana cool is a yay banana ,words of selection selection a banana this random banana a banana yay a banana banana a hello is a this 
David Wiglesworth,48,nonbinary,84,phd,Information Sciences,sciences,2,download3.jpg,words selection cool random is selection is yay this random ,of cool yay is hello of is banana random selection is selection random words yay banana cool yay a is 
Brittany Mejias,26,prefer not to say,63,masters,Journalist,sciences,5,download3.jpg,is a yay random selection cool is of a yay ,words banana of of random hello is cool yay yay yay random cool is words this a selection words of 
Cynthia Fox,21,male,39,phd,Media Science,arts,34,download2.jpg,this selection random is banana words yay words words cool ,yay this selection hello random this of cool selection words a yay is hello cool yay random random of words 
George Bradford,34,male,35,phd,Computer Scientist,arts,26,download.jpg,selection is is a words random cool selection a selection ,a a selection selection random selection of a a a words words cool is selection cool yay words selection a 
Yolanda Bush,58,male,42,high school,Information Sciences,arts,43,download3.jpg,selection yay cool cool yay is of this cool yay ,is this yay is this hello this cool is selection this selection hello words is a random cool words yay 
Lisa Nystrom,27,female,16,masters,Information Sciences,arts,12,download.jpg,yay a cool random selection yay banana random words of ,this words this this words a yay yay random cool selection of words cool hello a this is cool cool 
Timothy Cox,36,nonbinary,33,bachelor,Cognitive Science,arts,50,download3.jpg,this hello of this this cool selection yay words a ,words yay a hello is banana cool a selection cool hello a words of words selection words a of banana 
Mario Contreras,52,nonbinary,98,bachelor,Software Engineer,engineering,3,download1.jpg,selection cool is words is banana is cool cool cool ,hello random random of selection selection of cool random a of words a random selection words cool of yay words 
Jose Brown,59,prefer not to say,37,bachelor,Software Engineer,engineering,44,download3.jpg,words a cool selection is is this of hello is ,of words of cool this cool selection a words selection a selection selection words this banana banana yay yay yay 
Randolph Harris,35,male,100,masters,Software Engineer,engineering,20,download2.jpg,cool random banana selection of hello this selection this cool ,of yay of banana banana of of is a selection yay this this a cool selection selection selection selection selection 
Paul Parson,59,male,3,phd,Media Science,sciences,6,download2.jpg,is is is this banana this cool words banana hello ,cool selection of random random hello banana selection this this cool is is hello banana cool words hello cool selection 
April Brescia,53,prefer not to say,77,phd,Journalist,sciences,1,download2.jpg,is cool banana this random yay hello is hello this ,hello a banana hello cool cool random random is selection hello is selection words random random cool yay yay is 
Patty Washington,45,prefer not to say,15,high school,Media Science,engineering,9,download.jpg,is this yay words of random cool this words yay ,of random this selection of selection cool a banana cool cool cool words a this words hello random words of 
Bruce Lassiter,34,nonbinary,80,bachelor,Cognitive Science,sciences,32,download3.jpg,of cool hello hello a cool words words words banana ,is selection random this selection this banana a this hello a banana of banana of is hello cool banana cool 
Michelle Gruska,34,female,45,masters,Cognitive Science,engineering,48,download1.jpg,a words selection random selection banana yay random a words ,words of banana of hello is is this random banana a is hello hello selection is a yay cool a 
John Fairchild,63,male,79,masters,Cognitive Science,sciences,6,download2.jpg,a of is words yay selection hello of words banana ,banana cool a this yay random a selection random random cool this a cool selection yay cool a this cool 
Amy Burchette,64,nonbinary,16,masters,Computer Scientist,sciences,10,download.jpg,hello is this random hello hello of is words yay ,random cool banana selection cool yay hello hello yay random is a random random a words of of banana banana 
Alan Johnson,21,prefer not to say,7,high school,Journalist,sciences,36,download2.jpg,random cool hello cool of of banana words selection selection ,this banana cool selection is hello this of random selection cool banana yay this banana cool selection is a yay 
Robert Phariss,37,male,81,phd,Computer Scientist,arts,45,download3.jpg,is selection random hello is words hello yay words words ,words a yay of words a selection a words banana hello yay is random selection selection yay selection of a 
Ron Wilson,53,nonbinary,93,high school,Cognitive Science,sciences,40,download3.jpg,hello random cool hello words is random cool of random ,cool banana of random of yay banana words banana selection yay yay a this words hello words random random yay 
Annabel Price,38,male,92,phd,Journalist,engineering,42,download.jpg,a is is cool words random banana of of selection ,this of random words yay this words words cool random of banana banana hello banana selection random banana a hello 
Sandra Emerick,23,male,29,phd,Media Science,engineering,49,download2.jpg,this hello a banana of cool of cool of yay ,cool random is is a yay this hello selection is selection banana a yay is yay this is selection this 
Lee Robertson,46,male,44,high school,Journalist,sciences,49,download1.jpg,hello cool hello random is selection hello cool hello cool ,banana hello yay this a words selection this hello words a hello random hello a yay yay yay yay of 
Alicia Mitchell,29,nonbinary,11,masters,Information Sciences,arts,48,download.jpg,hello yay words banana words this selection cool hello random ,random banana random of banana words hello words words yay a hello this cool of a yay of selection a 
Cheryl Breckenridge,35,female,27,masters,Media Science,engineering,49,download2.jpg,cool is this selection hello this this is words words ,of words cool yay random yay this yay hello this this is a is hello words banana this hello banana 
Jessica Durham,60,male,48,phd,Software Engineer,sciences,31,download3.jpg,this yay a of hello words cool words hello is ,random words words of yay of banana words banana cool this is selection cool banana this words random selection a 
Richard Klebanow,53,nonbinary,7,bachelor,Media Science,sciences,32,download3.jpg,is random cool words banana random selection of is yay ,words words yay a random cool is hello is hello cool selection banana selection words random yay is selection cool 
Nellie Schmid,39,prefer not to say,89,high school,Cognitive Science,arts,16,download.jpg,random of yay yay this selection cool cool hello random ,selection words is cool cool cool yay yay random this words yay of banana banana is words this random banana 
Carol Silver,20,nonbinary,8,phd,Cognitive Science,engineering,29,download3.jpg,banana is yay random of a selection words random banana ,banana selection this a this yay banana is yay selection hello selection random words this words this random is of 
Ernest Evans,30,nonbinary,59,masters,Cognitive Science,sciences,2,download.jpg,random banana this hello is words hello hello banana hello ,random is hello of banana yay this this selection of is a hello this this random this of cool cool 
James Cookson,31,nonbinary,36,masters,Information Sciences,engineering,47,download1.jpg,yay cool random hello this yay words a hello banana ,this selection cool is words random random random this of cool a hello banana of a cool selection yay cool 
Hazel Richards,20,male,34,bachelor,Cognitive Science,engineering,36,download1.jpg,cool of random yay is cool a selection this random ,cool is is words words selection cool cool words a yay this words is is a hello words cool cool 
Shirley Maxwell,43,prefer not to say,55,phd,Information Sciences,sciences,19,download1.jpg,of selection this cool of selection yay hello yay a ,of is random selection is hello random a banana selection of this a a words of this of of a 
Jerry Dominguez,36,female,33,high school,Software Engineer,engineering,6,download3.jpg,yay words hello selection selection yay hello of random a ,selection is hello of is cool banana banana yay banana words of is yay of hello yay of yay random 
Albert Cooper,19,prefer not to say,65,high school,Computer Scientist,arts,35,download3.jpg,is yay words words hello of is a a selection ,is this random banana yay of yay yay words this random banana random is of banana is yay hello of 
Lee Banker,32,prefer not to say,1,high school,Media Science,engineering,10,download1.jpg,is hello banana cool cool selection of a hello of ,hello random selection random this of of a banana this banana words a of cool this this is of yay 
Steve Alejandre,31,female,73,masters,Software Engineer,engineering,37,download1.jpg,this yay yay random this this a banana random hello ,this random cool a is hello this a a selection of words banana yay words of hello cool yay words 
Freddie Kress,61,male,52,masters,Cognitive Science,sciences,2,download1.jpg,of is selection words hello banana words hello of hello ,of of of hello banana a random is hello hello banana is words banana this hello banana yay this is 
Jason Archibald,29,male,53,high school,Media Science,sciences,42,download3.jpg,a this yay this banana of random cool cool is ,a random yay yay cool words words of yay words this words a this of selection words selection hello of 
Marvin Machak,50,male,13,masters,Software Engineer,arts,37,download3.jpg,is random banana banana selection hello words yay random of ,of this words a words a cool hello yay a random selection random words a random words a hello is 
Fred Craighead,53,prefer not to say,13,masters,Software Engineer,sciences,19,download2.jpg,a hello yay words selection cool this yay a is ,words this hello of banana selection banana cool of a is yay is cool cool banana yay yay of of 
Arlene Coles,61,prefer not to say,32,high school,Journalist,sciences,11,download3.jpg,is selection cool this random is of hello hello words ,a random banana selection random this yay yay this banana is is yay selection this random cool is random words 
Betty Mccullough,39,female,39,bachelor,Software Engineer,engineering,44,download1.jpg,a banana random selection cool is this a words random ,selection is of banana of banana cool selection a cool banana is words of of banana of hello cool random 
Matthew Leak,32,prefer not to say,48,phd,Computer Scientist,engineering,38,download.jpg,random yay is random selection this yay words selection is ,a of selection random words words a selection banana of yay of random banana selection words banana banana random random 
Tom Crawford,28,male,10,bachelor,Journalist,sciences,46,download1.jpg,a of of yay a a of selection of words ,hello is yay is cool this random banana a words this yay yay words is banana cool a banana is 
