Name,Age,Sex,Python_score,Education_level,Education,Faculty,Years_experience,image,Text1,Text2
John Lacefield,54,nonbinary,9,high school,Journalist,arts,37,download3.jpg,words this banana banana words this random random random this ,selection of random selection selection random is hello hello yay hello hello of words hello words banana banana banana cool 
Josefina Tooms,32,male,34,phd,Computer Scientist,engineering,31,download.jpg,hello words this of a is this this of of ,of this hello is is of cool random this a words hello of this banana random this words banana of 
James Logan,18,nonbinary,19,high school,Journalist,engineering,5,download2.jpg,yay this a this hello is a banana selection cool ,this selection hello selection selection hello a is is selection selection cool this random cool of selection random hello selection 
Kimberly Ketron,33,nonbinary,15,high school,Cognitive Science,sciences,31,download2.jpg,this random yay words banana banana is cool selection a ,banana is this selection of yay hello selection words words words a selection banana cool selection words a yay cool 
Shirley Darley,62,prefer not to say,38,masters,Journalist,sciences,44,download.jpg,banana yay of cool random is yay yay is yay ,a hello selection yay is random selection random hello yay of is random hello banana words cool hello random this 
Morris Cook,39,nonbinary,50,masters,Software Engineer,arts,45,download.jpg,yay words is hello words of cool this banana selection ,is of yay yay yay a banana cool words selection random a is yay words of this words of hello 
Dana Matthew,28,male,38,bachelor,Computer Scientist,engineering,46,download2.jpg,hello selection banana yay hello words words cool yay words ,banana hello cool selection a yay of selection random cool random a hello banana is random this is selection this 
Dolores Wessner,36,female,40,masters,Computer Scientist,arts,33,download2.jpg,random random a yay random hello of yay banana a ,random cool this this yay a of a hello a yay yay selection of hello selection banana words random banana 
Harold Tickle,21,male,14,bachelor,Media Science,engineering,26,download1.jpg,banana banana is this is a a banana hello hello ,cool selection of hello cool a a is is cool cool hello hello hello yay yay of yay words words 
Reginald Ayala,43,male,77,phd,Cognitive Science,engineering,50,download3.jpg,is random yay yay of yay random of yay words ,a selection yay cool this of banana banana random this random random a selection a of words selection random words 
Elsie Rosado,57,male,94,phd,Information Sciences,engineering,24,download3.jpg,banana words selection words selection is words this random words ,banana hello yay yay this words banana yay random cool words cool banana cool selection hello yay banana of words 
Bobbi Delong,34,male,52,high school,Information Sciences,engineering,25,download1.jpg,cool of random banana of a is cool is is ,random a is yay words of yay is banana cool is this hello cool words hello cool yay hello cool 
Kenneth Leonard,62,male,64,bachelor,Information Sciences,engineering,8,download.jpg,yay this a yay of cool random cool hello a ,yay a is this this a banana selection banana words of hello banana banana hello yay this cool this hello 
Joshua Creed,64,female,16,masters,Information Sciences,engineering,34,download.jpg,selection of this banana banana a random cool this cool ,cool this hello yay a random this random random a is of words this yay hello a cool a of 
Jo Walton,42,female,50,high school,Media Science,arts,44,download1.jpg,banana banana random words yay hello selection this selection is ,hello of this random yay a random banana of a banana this hello random random random banana random random is 
Emma Carboni,58,female,69,phd,Software Engineer,sciences,32,download3.jpg,banana this a yay yay selection is banana selection yay ,of this cool is random is yay words hello a yay selection a of words this banana yay cool words 
Myrtle Dana,54,female,58,phd,Journalist,sciences,26,download2.jpg,banana of a cool yay of selection of cool cool ,cool selection banana selection is is random banana hello yay random words random selection hello words a of yay selection 
Teresa Wynn,44,male,18,phd,Media Science,sciences,17,download1.jpg,a cool banana words hello yay hello this is words ,is is is yay selection banana yay hello of hello of hello yay hello cool yay this is random yay 
Christy Anthony,29,male,66,masters,Software Engineer,engineering,45,download.jpg,this a selection cool a banana this this selection is ,random is selection hello words yay random cool selection is cool this of of yay of hello of banana a 
Ellen Broussard,60,prefer not to say,59,phd,Information Sciences,engineering,8,download1.jpg,banana words a hello hello hello a selection banana cool ,selection of of cool hello of yay banana random words words this hello yay a a cool hello yay of 
Jacqueline Hickling,58,prefer not to say,98,bachelor,Computer Scientist,sciences,23,download.jpg,selection is hello cool a this random banana selection of ,of a random a is words words this yay yay yay words is a banana a hello a this a 
Patricia Waites,41,female,22,masters,Information Sciences,sciences,9,download3.jpg,of cool banana of of this this selection cool words ,hello banana a this is banana cool hello random a hello banana selection selection hello banana yay of selection words 
Frank Ponder,19,prefer not to say,15,high school,Information Sciences,arts,36,download2.jpg,is this selection yay a is of this of cool ,is yay random banana a is of hello selection banana of cool this cool cool random a cool cool cool 
George Sanchez,41,nonbinary,34,high school,Information Sciences,engineering,44,download2.jpg,is banana hello yay yay banana words this words this ,words cool of words random selection yay is is selection a yay banana words this of hello of cool hello 
Denise Kruse,45,nonbinary,7,phd,Media Science,arts,18,download2.jpg,selection of banana banana banana hello this banana hello of ,yay hello hello is cool this of banana selection of this cool is this random selection a selection cool selection 
Bree Davis,35,prefer not to say,89,high school,Cognitive Science,sciences,45,download.jpg,hello cool random words yay words words random words hello ,random is a of random cool banana random random cool yay of cool this cool random this a random this 
Samantha Nunn,62,female,26,high school,Journalist,engineering,13,download3.jpg,of this of banana banana cool is of words words ,banana words words of a a is cool random hello a a a banana a hello yay cool is is 
Kathleen Wood,18,female,21,bachelor,Journalist,arts,20,download3.jpg,yay this a is a words words cool of cool ,selection is of random yay banana selection is yay of banana selection is cool yay banana random is random of 
Woodrow Ballard,62,nonbinary,23,phd,Software Engineer,arts,50,download2.jpg,is of is yay words words yay this cool words ,random this of words of selection cool words banana is of banana this banana a of selection cool is a 
Marian Thorpe,63,nonbinary,93,high school,Cognitive Science,engineering,48,download1.jpg,banana selection of is random words of banana cool words ,cool of selection this selection of yay words cool banana yay is this banana cool selection yay words a cool 
Ashley Thigpen,61,nonbinary,29,high school,Information Sciences,sciences,6,download3.jpg,this a cool hello random is selection words words yay ,yay random cool words of selection banana banana banana words this words banana this words yay words of banana of 
Louis Mccabe,53,female,28,phd,Computer Scientist,sciences,13,download2.jpg,hello a banana yay is random banana words hello words ,of random is banana random random cool words selection hello yay selection is words selection this selection yay of a 
Cleveland Richard,30,female,60,masters,Information Sciences,engineering,0,download3.jpg,cool words random is banana words random selection is words ,is cool hello selection hello is of cool yay banana cool selection yay banana is is words a banana words 
Marian Bolden,40,female,64,masters,Information Sciences,engineering,12,download.jpg,words this cool of random of this selection selection a ,words selection random cool yay cool of a cool random words random this words a selection banana words banana is 
Latoya Bates,42,prefer not to say,49,high school,Media Science,sciences,11,download2.jpg,a words hello hello a random yay cool a selection ,a a words of selection is a is words hello selection hello random a is this banana yay words selection 
Samuel Mackey,18,nonbinary,56,phd,Media Science,arts,6,download.jpg,of random is cool yay words is selection banana selection ,cool is words yay a selection cool random a a words words yay of a hello a banana of random 
Fred Ontiveros,50,male,77,phd,Journalist,arts,6,download.jpg,banana cool of yay random this a is cool yay ,cool words banana hello cool cool hello cool is selection random this this this is selection this words a a 
Gustavo Turner,22,prefer not to say,23,phd,Media Science,engineering,47,download1.jpg,cool a this this a of words is banana banana ,banana this words a words this cool cool cool random a random is is this yay is a this banana 
Roxanne Guhl,19,prefer not to say,17,masters,Information Sciences,arts,48,download1.jpg,this of cool selection hello random a is yay of ,banana selection a this hello random words banana words hello hello a this yay banana selection banana yay is is 
Curtis Anderson,60,nonbinary,29,masters,Media Science,sciences,2,download1.jpg,words banana yay yay words is hello banana of this ,hello this random is cool of a selection of random selection words banana words yay is banana selection a this 
Richard Thompson,44,prefer not to say,99,masters,Computer Scientist,sciences,0,download2.jpg,cool of is is hello words this hello cool random ,selection hello a selection hello banana random random words this words is yay selection hello words random of selection random 
Robert Lopez,24,prefer not to say,79,bachelor,Journalist,arts,35,download1.jpg,is this random selection this yay cool cool random selection ,of banana yay cool cool of cool hello banana random a random a cool random yay a hello of of 
Brenda Bates,55,nonbinary,65,phd,Media Science,arts,0,download2.jpg,random a random selection this yay cool words selection yay ,words cool of of a random cool banana this cool this of random is this of hello banana selection of 
Priscilla Brymer,61,male,21,bachelor,Media Science,engineering,24,download2.jpg,random selection random hello words a selection hello words a ,hello cool banana of words yay of hello selection banana yay a of selection cool random words yay is this 
Curtis Aguilera,55,male,0,high school,Cognitive Science,sciences,14,download1.jpg,this is yay cool cool this this words random words ,yay banana a of banana words a cool is random words words cool banana of banana selection selection this of 
Robin Lowe,35,nonbinary,65,masters,Journalist,engineering,3,download3.jpg,hello cool is hello banana selection words words is words ,words random banana yay is yay words hello is selection of of this hello words this cool this is this 
Kathleen Hammen,58,prefer not to say,61,high school,Information Sciences,arts,3,download.jpg,a a words selection hello selection words random selection yay ,a of hello yay is banana hello selection a banana this random this hello words a cool banana hello yay 
Andrea Levar,24,prefer not to say,17,bachelor,Information Sciences,engineering,20,download.jpg,hello random words is banana cool cool a hello cool ,words this random this random selection banana of this a of yay a cool words of words selection hello random 
Kristen Eyre,43,female,34,masters,Software Engineer,engineering,5,download2.jpg,a words cool a yay yay a words a cool ,is banana words banana random cool hello yay cool cool cool cool words yay hello hello yay hello yay banana 
William Braithwaite,37,prefer not to say,95,masters,Media Science,arts,9,download3.jpg,this banana yay banana this selection a is this is ,hello banana yay banana this random selection random a words of this banana is words yay this random is yay 
Richard Green,26,female,17,phd,Media Science,arts,33,download3.jpg,of a is this this cool is a random random ,this words cool random selection yay words random this is random selection yay random a this a words words selection 
David Anderson,59,prefer not to say,81,bachelor,Media Science,arts,47,download3.jpg,yay is selection words words hello words of is hello ,banana random is random hello banana is words banana is of selection yay hello words of a cool words hello 
Robert Slater,46,female,43,phd,Information Sciences,sciences,0,download2.jpg,yay hello this this of of banana random of of ,is of this of random a yay a selection words cool selection selection a words is a is selection banana 
Jason Gorman,22,nonbinary,28,masters,Software Engineer,sciences,49,download.jpg,banana cool this a is is yay cool words banana ,yay of this hello is random is words hello words is selection hello cool hello cool this cool words cool 
Judith Jackson,19,female,38,masters,Software Engineer,arts,36,download.jpg,yay banana of selection a of this this yay of ,banana random yay selection a random random yay selection hello words cool yay a yay words random a hello words 
Jason Ennis,22,male,31,bachelor,Journalist,arts,28,download.jpg,words yay words hello banana is banana a words cool ,banana hello of cool yay cool of banana yay words a of words banana random banana is this random random 
Nathaniel Cunningham,63,nonbinary,50,phd,Information Sciences,engineering,5,download3.jpg,words of a a this words hello selection cool random ,random a hello yay words hello selection cool yay random a a a this yay hello hello banana hello hello 
Sylvester Champion,27,female,73,phd,Computer Scientist,engineering,24,download3.jpg,a selection of this yay selection yay of this cool ,is words selection this yay a random hello hello selection yay selection of this yay words selection banana banana is 
Kenneth White,52,prefer not to say,83,masters,Software Engineer,arts,24,download2.jpg,selection of yay hello hello of yay this random words ,yay a random yay random of this cool cool this a cool a a this is cool yay this a 
Renda Jones,47,prefer not to say,87,masters,Media Science,engineering,44,download2.jpg,hello a is of this banana a of this cool ,cool cool yay cool yay hello a this selection cool hello of selection selection cool this words this words selection 
Sean Royce,18,male,38,high school,Journalist,sciences,18,download.jpg,yay this a is hello yay banana hello words yay ,banana of hello hello a selection of a random words cool hello cool random of a is this selection banana 
Joseph Hang,56,female,46,masters,Media Science,arts,27,download2.jpg,is hello random random yay yay is is hello random ,cool words banana yay yay words yay of yay hello of hello of selection random cool banana a yay cool 
Lillie Perez,41,male,61,masters,Media Science,arts,8,download.jpg,selection banana words cool selection this random words banana a ,this is yay banana yay banana banana is selection hello hello cool yay banana words yay a words words banana 
Maurice Smith,59,prefer not to say,5,phd,Information Sciences,arts,47,download3.jpg,cool random is words is words selection of yay yay ,a yay random a cool yay words a hello words selection of this hello is a words cool banana this 
Christopher Barnhart,48,prefer not to say,23,high school,Information Sciences,sciences,29,download2.jpg,banana cool banana hello is is selection words selection random ,words is is selection words selection this of hello a a yay banana selection cool yay words of this a 
Lori Arnaud,20,nonbinary,58,bachelor,Media Science,engineering,37,download1.jpg,cool hello hello banana hello words is is of random ,hello yay of cool of banana selection a cool selection hello random of random cool banana words words words a 
Norman Ferguson,51,nonbinary,29,phd,Software Engineer,engineering,26,download.jpg,banana random a selection yay words selection random selection random ,selection this random banana is a selection cool selection selection cool a yay cool random banana a random a words 
Cira Harris,38,prefer not to say,89,phd,Information Sciences,arts,2,download3.jpg,banana hello cool this hello is words hello of cool ,random banana banana banana yay cool selection this selection words hello selection cool words random random cool selection hello this 
Lionel Brown,52,prefer not to say,5,phd,Computer Scientist,arts,25,download2.jpg,cool yay hello banana selection this hello this is random ,is is a this cool yay banana of yay cool yay words selection random is yay of this random a 
Wayne Quinonez,24,prefer not to say,45,bachelor,Journalist,arts,28,download1.jpg,hello cool selection selection random is banana is is banana ,cool is is random of a of yay of selection this hello this of selection selection cool selection hello this 
Jody Bradshaw,19,prefer not to say,32,masters,Journalist,sciences,1,download1.jpg,words words words is cool a banana selection hello random ,this hello this selection of is is a banana is cool hello yay is is this hello of is is 
Carmela Perez,31,nonbinary,69,phd,Information Sciences,arts,44,download1.jpg,banana hello banana yay hello hello selection yay banana of ,random cool this of a is banana a random random is yay this this is words cool a cool banana 
Judy Zamora,18,female,32,phd,Software Engineer,engineering,28,download1.jpg,yay a words yay banana words banana words banana random ,of banana banana words yay yay banana hello yay this yay is words selection words of of random selection random 
Ruby Eldreth,22,prefer not to say,50,phd,Software Engineer,arts,36,download3.jpg,hello a hello banana is random a banana hello words ,of hello this is is banana banana words of random cool selection hello banana cool yay is this this is 
Naomi Marchese,58,female,29,phd,Computer Scientist,sciences,40,download1.jpg,random banana is random banana cool hello hello this random ,words a words banana selection of selection is hello of a hello a banana a selection hello random is selection 
Chong Moses,63,male,24,high school,Cognitive Science,sciences,14,download.jpg,this hello banana random random banana a selection banana a ,this hello banana words is this is a of this is banana is words words yay words this this cool 
Andrew Abad,41,prefer not to say,51,phd,Cognitive Science,arts,43,download1.jpg,banana this selection selection selection words cool words cool random ,words this is words selection cool words random cool banana of random selection of this words this words selection is 
Rick Surles,25,nonbinary,59,masters,Media Science,arts,10,download2.jpg,of cool banana selection selection this of of words is ,is banana selection hello words is banana banana yay selection cool words banana cool a yay selection yay a hello 
Marcus Hall,61,male,68,bachelor,Software Engineer,engineering,25,download2.jpg,random words a a selection is words a hello is ,words a words words a is of this random cool words is yay banana random is of is selection is 
Lucy Johnson,45,male,91,masters,Software Engineer,engineering,9,download1.jpg,this selection banana random selection hello words cool words random ,yay yay this selection yay selection hello yay a random words a cool a selection this cool is selection banana 
Justin Fonte,33,female,42,phd,Software Engineer,sciences,0,download1.jpg,random cool cool words hello this a cool cool words ,selection a a words a cool a this selection cool selection of cool banana cool is selection words cool banana 
Anthony Scott,37,prefer not to say,50,high school,Computer Scientist,sciences,47,download.jpg,yay words yay cool banana random words a hello this ,selection selection words yay banana random selection this selection is this this hello random hello hello selection of a is 
Matthew Congrove,51,female,7,high school,Cognitive Science,sciences,4,download3.jpg,is random this this is random hello hello words random ,this yay of words a this hello hello a this cool yay hello a selection yay this selection yay banana 
Beverly Watson,21,prefer not to say,60,phd,Journalist,arts,45,download2.jpg,of banana this a selection banana of selection selection selection ,random words words words random words words hello a this selection cool hello banana this banana random banana this is 
Charles Sheroan,61,male,85,high school,Media Science,engineering,40,download.jpg,yay hello cool selection is of of this of random ,cool random words hello words banana cool selection is words is yay banana banana of is this of hello is 
Emelda Simar,26,nonbinary,44,high school,Computer Scientist,arts,0,download.jpg,words random banana this words banana of of of cool ,hello a this cool hello words cool a hello this cool a selection of hello selection hello random words banana 
Bernard Gee,59,female,64,phd,Media Science,arts,28,download2.jpg,hello selection of hello random words yay random banana this ,cool words hello random words selection of cool hello random words banana banana a selection random yay cool cool hello 
Brenda Lira,26,female,43,bachelor,Information Sciences,arts,20,download.jpg,selection cool random random this words is a yay words ,a this yay this of hello cool random hello this banana a of a cool words banana a selection selection 
Darryl Shiffer,56,prefer not to say,91,phd,Information Sciences,arts,25,download3.jpg,words banana hello cool a selection a a words random ,words yay random selection cool this a cool hello selection hello banana this selection of cool cool banana words selection 
Louis Grant,31,male,63,high school,Computer Scientist,engineering,44,download3.jpg,of this selection is cool selection selection selection words banana ,of selection a this a selection banana random is selection this random cool cool hello words a this a is 
Richard Lee,52,female,21,masters,Information Sciences,sciences,23,download1.jpg,words of words random random cool of is yay selection ,banana banana of is random yay cool words is selection words cool hello hello cool of words random is banana 
Wesley Kilian,40,male,74,high school,Cognitive Science,arts,45,download2.jpg,selection words cool selection of selection hello random is yay ,is cool yay hello cool hello this a selection of random this banana hello selection selection random words random a 
Joseph Wicklund,28,prefer not to say,38,masters,Media Science,engineering,50,download.jpg,is words cool is of banana cool is words random ,hello of words words hello random of hello is of words hello this a cool this yay words a hello 
Stanley Mcfarland,36,male,51,bachelor,Computer Scientist,arts,31,download3.jpg,banana cool this cool random cool is banana banana cool ,a banana is random this cool banana this selection a a hello selection this hello banana yay yay of selection 
Ann Romero,52,prefer not to say,7,high school,Journalist,arts,45,download3.jpg,selection a is banana random a a banana this words ,yay hello random hello is is random random random of of selection banana this yay cool of of cool cool 
Jean Coney,29,nonbinary,31,bachelor,Computer Scientist,engineering,18,download.jpg,cool banana of banana of this random random a yay ,a selection is selection a banana words words selection this cool selection selection hello this selection hello random this is 
Ernest Schoemaker,53,female,56,bachelor,Software Engineer,sciences,46,download2.jpg,a this selection banana selection is random of random a ,of hello hello hello selection selection of banana yay cool selection random cool yay of a is yay random selection 
Jason Maymi,56,female,25,masters,Journalist,arts,21,download1.jpg,a this cool cool this a this a this this ,a hello yay random this a a this words words of hello selection selection of cool is of of selection 
Connie Noonan,35,female,78,bachelor,Software Engineer,engineering,30,download3.jpg,words banana a of this this yay cool cool this ,this is yay banana random selection hello selection this banana of of random is selection yay words hello words selection 
Craig Shelton,44,nonbinary,34,bachelor,Media Science,arts,0,download2.jpg,a a banana a a selection selection banana of cool ,of this yay words cool this of cool yay selection words a is this banana cool words is yay words 
Kara Henry,36,prefer not to say,93,bachelor,Software Engineer,engineering,5,download.jpg,this hello random banana words hello this random banana cool ,is of of cool a this is yay yay hello random banana hello is this is selection random cool words 
Inez Boykin,26,male,80,masters,Journalist,arts,9,download2.jpg,cool yay hello words is words cool cool cool a ,words yay of yay yay cool a selection selection a banana selection random random a cool yay selection is banana 
Jimmy Quinn,38,nonbinary,46,masters,Software Engineer,arts,21,download2.jpg,random this a of a yay a cool is cool ,this a a banana this is cool selection this yay a selection banana words words yay of words yay cool 
James Chase,37,female,82,high school,Software Engineer,arts,31,download3.jpg,cool random random is is of random selection this of ,hello is a a is is of is words selection of of random yay banana of selection selection banana a 
Catherine Pogozelski,65,male,46,bachelor,Cognitive Science,sciences,45,download3.jpg,yay selection selection selection selection yay cool this banana is ,this hello is this banana banana of yay selection cool random hello cool yay selection selection this words banana random 
Veronica Smith,64,male,65,phd,Journalist,engineering,32,download2.jpg,is hello selection selection this this banana cool of hello ,words random a random cool a of selection a yay of this a random banana hello this is yay banana 
