Name,Age,Sex,Python Score,Education Level,Education,Faculty,Workfields,Years Experience,image,Personality Profiles,Strength,Text1,Text2,English Proficiency,GPA,Skills,Motivation Letter,SQL Score,ID
Martha Monroe,50,female,75,High School,Cognitive Science,engineering,software programming,10,download1.jpg,32_personality.png,Great with tech,yay of is this a words is banana cool banana ,random is words banana this is hello random words cool hello banana random hello random cool cool random of words ,Limited,4.977270691742595,"Skills: problem solving, java and juristics","I grew up around animals living on a farm in rural Wyoming. During this time, I was involved in many aspects of animal care, including training our dogs, grooming our horses and milking cows. I loved spending time with our animals and discovered how wonderful their companionship can be. I also learned the importance of the less glamorous sides of animal care, including cleaning waste and pens to keep our creatures comfortable.",58,Corn Avocado
Stephen Biro,64,male,25,Postdoc,Software Engineer,sciences,accounting,21,download.jpg,34_personality.png,Efficient and a teamplayer,words hello a a random banana banana hello words this ,hello this of this cool banana banana yay a of banana of banana is selection cool selection hello selection of ,Limited,8.314003123557592,"Skills: analytics, communication and java",I love the way different colors and images can evoke emotions in viewers. I enjoy experimenting with the power of color and imagery and think I have a natural creative flair. I am confident that I will be able to apply this flair to new projects and increase my design abilities at your school.,24,Steel Citrus
Jerome Fisher,26,male,50,High School,Software Engineer,sciences,software programming,2,download3.jpg,30_personality.png,Creative and solution-minded,a words words selection of a banana is yay cool ,words banana banana is a this words this words is words this yay words random words is of of banana ,No Proficiency,0.33204370951434026,"Skills: excel, python and statistics","Through my veterinary science studies, I have learned even more about animal care, including how to diagnose and treat animal diseases and how to help animals give birth. I believe these skills, along with the experience I acquired on the farm, would be invaluable to you at All Paws Animal Shelter. I also believe I could learn a lot more to complement my schooling at your organization.",69,Avocado Raspberry
Cindy Mode,48,female,38,High School,Media Science,arts,software programming,22,download1.jpg,1_personality.png,Creative and solution-minded,selection this banana hello yay random this selection a hello ,is words random is random this of a random selection hello hello of is words selection banana hello banana selection ,Professional,0.8971159090525649,"Skills: statistics, communication and word","I hope to become a web designer, so I would like to learn more about multimedia design. I feel your course would help me understand the digital design process and the way websites and their visual imagery can help businesses present images to consumers.",97,Cyan Avocado
Andrew Hardiman,62,male,39,High School,Software Engineer,arts,management,6,download3.jpg,35_personality.png,Great with tech,this selection is selection this selection is a words a ,banana words yay banana this selection is of of random words banana a of is banana cool hello words banana ,Limited,2.341992731784557,"Skills: word, java and management","Through my veterinary science studies, I have learned even more about animal care, including how to diagnose and treat animal diseases and how to help animals give birth. I believe these skills, along with the experience I acquired on the farm, would be invaluable to you at All Paws Animal Shelter. I also believe I could learn a lot more to complement my schooling at your organization.",79,Cream Date
Thomas Hatley,34,male,43,Masters,Media Science,engineering,databases,10,download1.jpg,0_personality.png,Love working with coworkers,this yay banana a words of random words yay words ,of this of this words this random a a selection is banana cool is yay cool this cool is hello ,Professional,3.7760525941726364,"Skills: communication, python and statistics","I hope to become a web designer, so I would like to learn more about multimedia design. I feel your course would help me understand the digital design process and the way websites and their visual imagery can help businesses present images to consumers.",33,Asphalt Cherry
Gary Hensley,45,male,34,Masters,Journalist,engineering,management,22,download2.jpg,17_personality.png,Creative and solution-minded,is hello this banana yay hello words cool a a ,this cool a a words this hello of yay hello this banana hello words yay banana this random hello is ,Advanced,4.590374352860826,"Skills: problem solving, java and python","As my mother worked long hours, I spent a lot of time caring for my youngest brother who has cerebral palsy. I feel the time I spent caring for him sparked an interest in nursing. I learned to be compassionate and patient and was rewarded by his smiles. I hope to make my own patients smile in the face of their own health concerns in the future.",74,Chartreuse Orange
Frieda Clemons,46,female,99,Masters,Computer Scientist,engineering,accounting,10,download3.jpg,27_personality.png,Creative and solution-minded,selection of words banana is banana random hello this this ,banana selection this hello hello words selection of a random of this is a yay hello hello a random words ,Advanced,2.9050086809987596,"Skills: java, management and excel","I grew up around animals living on a farm in rural Wyoming. During this time, I was involved in many aspects of animal care, including training our dogs, grooming our horses and milking cows. I loved spending time with our animals and discovered how wonderful their companionship can be. I also learned the importance of the less glamorous sides of animal care, including cleaning waste and pens to keep our creatures comfortable.",39,Coral Coconut
Allen Gregg,52,male,15,Postdoc,Software Engineer,arts,accounting,25,download1.jpg,13_personality.png,Great with tech,this yay selection is selection cool a random cool selection ,cool yay hello of banana a words words is random is yay this is hello yay words random words is ,No Proficiency,8.615448930636223,"Skills: communication, excel and problem solving","I grew up in a lower-income family with a single mother who worked three jobs to provide for my brothers and me. My mother taught me the value of hard work and the importance of taking care of others who cannot take care of themselves. She also stressed the importance of education to us, teaching us that it would help us access an easier life. Her encouragement along with my own determination helped me earn some of the best grades in my high school class.",13,Brass Berry
Jordan Edwards,51,female,41,Masters,Cognitive Science,arts,software programming,18,download.jpg,47_personality.png,Great with tech,cool random a cool of banana yay a selection selection ,selection this of this is random words selection yay of hello random random selection a is selection is hello cool ,Limited,6.479539988883463,"Skills: statistics, communication and analytics","As my mother worked long hours, I spent a lot of time caring for my youngest brother who has cerebral palsy. I feel the time I spent caring for him sparked an interest in nursing. I learned to be compassionate and patient and was rewarded by his smiles. I hope to make my own patients smile in the face of their own health concerns in the future.",55,Tomato Raspberry
James Buhl,45,male,85,High School,Computer Scientist,engineering,software programming,14,download2.jpg,6_personality.png,Great with tech,selection of random random this selection random cool hello hello ,selection cool a hello a of this words cool hello this this selection words selection hello selection cool words of ,Advanced,2.325527236346269,"Skills: communication, excel and management","As my mother worked long hours, I spent a lot of time caring for my youngest brother who has cerebral palsy. I feel the time I spent caring for him sparked an interest in nursing. I learned to be compassionate and patient and was rewarded by his smiles. I hope to make my own patients smile in the face of their own health concerns in the future.",100,Cerulean Kiwi
Justin Denson,33,male,10,Bachelor,Cognitive Science,engineering,service industry,18,download2.jpg,38_personality.png,Efficient and a teamplayer,of a selection this random random banana of selection yay ,yay this a of cool of cool of a random selection selection this banana is hello this random a is ,Professional,9.335082826517136,"Skills: word, excel and communication","I hope to become a web designer, so I would like to learn more about multimedia design. I feel your course would help me understand the digital design process and the way websites and their visual imagery can help businesses present images to consumers.",47,Burgundy Mango
Norman Pittman,37,male,60,Postdoc,Media Science,engineering,accounting,13,download1.jpg,48_personality.png,Efficient and a teamplayer,random cool words hello yay hello words selection yay random ,cool banana cool selection selection banana banana a hello hello a is this of random of yay words of banana ,Professional,0.18312566116765572,"Skills: statistics, powerpoint and communication","I grew up in a lower-income family with a single mother who worked three jobs to provide for my brothers and me. My mother taught me the value of hard work and the importance of taking care of others who cannot take care of themselves. She also stressed the importance of education to us, teaching us that it would help us access an easier life. Her encouragement along with my own determination helped me earn some of the best grades in my high school class.",44,Orange Guava
Selma Williams,43,female,16,Masters,Computer Scientist,engineering,service industry,17,download3.jpg,19_personality.png,Efficient and a teamplayer,of a selection yay yay banana a this selection a ,words selection cool hello hello of banana a a a selection hello is hello selection banana a cool cool random ,Advanced,9.706696778069304,"Skills: communication, analytics and powerpoint","I respect Seattle Universitys reputation for academic and sporting excellence. I appreciate that yours is a school that encourages students to achieve their potential both inside and outside the classroom. As a social person who has participated in several extracurricular activities, including the school band and softball team, I feel my diverse interests would make me a great fit for your school.",62,Fuchsia Orange
Melissa Harris,61,female,14,Postdoc,Journalist,sciences,management,7,download3.jpg,41_personality.png,Very commited and fierce,banana selection random hello words yay hello words selection random ,words cool words of cool is is cool cool banana is random yay yay selection a this of yay random ,No Proficiency,9.850988929392633,"Skills: word, java and python","I am especially interested in working at All Paws Animal Shelter as you accept a diverse range of animals. I also appreciate your shelters no-kill policy and commitment to ongoing care for senior animals. These policies align with my own belief that all animals deserve the chance to live a long life and find a forever home, no matter how long that takes.",66,Coal Citrus
Mary Garcia,26,female,94,Ph.d.,Media Science,arts,accounting,8,download1.jpg,22_personality.png,Efficient and a teamplayer,cool yay yay banana is words a words yay of ,cool yay hello a banana hello selection selection words is selection banana yay selection yay selection a this of this ,Limited,8.276239533297154,"Skills: statistics, problem solving and analytics",I love the way different colors and images can evoke emotions in viewers. I enjoy experimenting with the power of color and imagery and think I have a natural creative flair. I am confident that I will be able to apply this flair to new projects and increase my design abilities at your school.,71,Yellow Plum
Amanda Johnson,40,female,45,Bachelor,Computer Scientist,engineering,management,23,download2.jpg,25_personality.png,Creative and solution-minded,words random of yay selection yay words yay cool selection ,cool cool hello this of random cool this is a is random this of this is words selection selection banana ,Limited,7.197394762082364,"Skills: juristics, analytics and statistics","I grew up in a lower-income family with a single mother who worked three jobs to provide for my brothers and me. My mother taught me the value of hard work and the importance of taking care of others who cannot take care of themselves. She also stressed the importance of education to us, teaching us that it would help us access an easier life. Her encouragement along with my own determination helped me earn some of the best grades in my high school class.",2,Gold Kiwi
Kimberly Thomas,61,female,45,Bachelor,Cognitive Science,arts,management,18,download2.jpg,33_personality.png,Creative and solution-minded,a of random a banana random cool banana cool cool ,banana this selection is of a this cool words yay this selection selection banana this is selection random a words ,Limited,0.5049856663412045,"Skills: juristics, java and communication","I grew up in a lower-income family with a single mother who worked three jobs to provide for my brothers and me. My mother taught me the value of hard work and the importance of taking care of others who cannot take care of themselves. She also stressed the importance of education to us, teaching us that it would help us access an easier life. Her encouragement along with my own determination helped me earn some of the best grades in my high school class.",94,Heather Kiwi
David Black,46,male,0,Postdoc,Information Sciences,sciences,software programming,11,download.jpg,18_personality.png,Very commited and fierce,banana cool of hello yay hello a of banana selection ,hello this a yay of selection of this of a cool random of this yay is a of hello of ,Professional,0.004189253060180587,"Skills: java, statistics and python","I hope to become a web designer, so I would like to learn more about multimedia design. I feel your course would help me understand the digital design process and the way websites and their visual imagery can help businesses present images to consumers.",74,Tomato Melon
James Perkins,61,male,59,Postdoc,Software Engineer,arts,software programming,1,download.jpg,11_personality.png,Love working with coworkers,cool a words yay a words a words hello hello ,a random is selection random selection a words yay random random this a words words hello words yay this of ,Native,5.435978837509959,"Skills: python, management and word","I respect Seattle Universitys reputation for academic and sporting excellence. I appreciate that yours is a school that encourages students to achieve their potential both inside and outside the classroom. As a social person who has participated in several extracurricular activities, including the school band and softball team, I feel my diverse interests would make me a great fit for your school.",26,Silver Cantaloupe
Donna Byrant,21,female,7,Postdoc,Cognitive Science,sciences,management,5,download.jpg,11_personality.png,Great with tech,words this selection selection yay yay of hello this yay ,this this this a is this a banana of banana yay banana words hello words a is selection hello hello ,No Proficiency,7.692397432338366,"Skills: excel, analytics and statistics","Studying at your school would help me develop my aptitude for design while having fun, whether it is on the sporting field or in another arena. I am open to whatever experiences life at Seattle University would bring me and hope I could achieve them through your multimedia design and communication degree. Thank you very much for considering my request",49,Feldspar Raisin
Lucy Nash,47,female,47,Ph.d.,Information Sciences,arts,service industry,6,download2.jpg,13_personality.png,Very commited and fierce,a random yay hello words is cool banana a selection ,this this yay this banana cool words cool cool cool banana banana cool cool of yay yay hello is this ,Native,3.5979503247370035,"Skills: excel, python and management","I hope to become a web designer, so I would like to learn more about multimedia design. I feel your course would help me understand the digital design process and the way websites and their visual imagery can help businesses present images to consumers.",32,White Citrus
Alan Cooley,38,male,16,Ph.d.,Software Engineer,sciences,databases,9,download2.jpg,35_personality.png,Great with tech,cool is is words hello a random hello hello of ,is is hello a words of random random banana a selection banana yay a yay random cool of this hello ,Native,6.804364706389726,"Skills: management, analytics and statistics",I love the way different colors and images can evoke emotions in viewers. I enjoy experimenting with the power of color and imagery and think I have a natural creative flair. I am confident that I will be able to apply this flair to new projects and increase my design abilities at your school.,14,Bone Guava
Patrick Friedman,55,male,86,Bachelor,Journalist,engineering,service industry,21,download3.jpg,29_personality.png,Love working with coworkers,yay is this selection selection is banana of cool a ,words of this this words random this yay banana is is a random hello random cool a this random is ,Native,1.905585362373885,"Skills: java, python and problem solving","I am especially interested in working at All Paws Animal Shelter as you accept a diverse range of animals. I also appreciate your shelters no-kill policy and commitment to ongoing care for senior animals. These policies align with my own belief that all animals deserve the chance to live a long life and find a forever home, no matter how long that takes.",13,Aquamarine Guava
Kevin Gillman,54,male,63,Ph.d.,Computer Scientist,engineering,databases,9,download3.jpg,48_personality.png,Great with tech,random banana a hello of selection cool yay cool of ,banana random of random this cool is hello a random selection random random is of random hello of banana yay ,No Proficiency,3.18788085994305,"Skills: excel, problem solving and statistics","I grew up around animals living on a farm in rural Wyoming. During this time, I was involved in many aspects of animal care, including training our dogs, grooming our horses and milking cows. I loved spending time with our animals and discovered how wonderful their companionship can be. I also learned the importance of the less glamorous sides of animal care, including cleaning waste and pens to keep our creatures comfortable.",27,Green Cherry
Taylor Martin,50,male,18,Ph.d.,Software Engineer,arts,accounting,20,download3.jpg,29_personality.png,Love working with coworkers,is is this words words words a selection a this ,this words cool hello this is a this random random words a words words a words is selection is hello ,Limited,7.550126475756036,"Skills: powerpoint, excel and communication","I am especially interested in working at All Paws Animal Shelter as you accept a diverse range of animals. I also appreciate your shelters no-kill policy and commitment to ongoing care for senior animals. These policies align with my own belief that all animals deserve the chance to live a long life and find a forever home, no matter how long that takes.",61,Black Plum
James Garcia,50,male,94,Postdoc,Information Sciences,engineering,databases,22,download1.jpg,45_personality.png,Great with tech,this banana a hello is of a random cool words ,yay random selection a cool yay a random cool random cool random words a yay of yay banana random is ,Limited,2.410973548006524,"Skills: python, java and powerpoint","Studying at your school would help me develop my aptitude for design while having fun, whether it is on the sporting field or in another arena. I am open to whatever experiences life at Seattle University would bring me and hope I could achieve them through your multimedia design and communication degree. Thank you very much for considering my request",59,Steel Apple
Dawn Myers,39,female,77,Ph.d.,Software Engineer,engineering,software programming,17,download1.jpg,28_personality.png,Efficient and a teamplayer,selection banana is banana selection is of a hello a ,random this a this banana selection random yay hello of is hello yay cool yay is hello selection is of ,Limited,3.0232767814609742,"Skills: analytics, communication and juristics","I grew up around animals living on a farm in rural Wyoming. During this time, I was involved in many aspects of animal care, including training our dogs, grooming our horses and milking cows. I loved spending time with our animals and discovered how wonderful their companionship can be. I also learned the importance of the less glamorous sides of animal care, including cleaning waste and pens to keep our creatures comfortable.",31,Blue Berry
Lee Huntley,23,male,1,Bachelor,Software Engineer,engineering,accounting,19,download1.jpg,17_personality.png,Love working with coworkers,selection words is of cool yay is hello is random ,words hello random selection words banana hello is banana cool random hello cool is a this this cool cool yay ,Limited,4.619980883507814,"Skills: analytics, statistics and problem solving","I am especially interested in working at All Paws Animal Shelter as you accept a diverse range of animals. I also appreciate your shelters no-kill policy and commitment to ongoing care for senior animals. These policies align with my own belief that all animals deserve the chance to live a long life and find a forever home, no matter how long that takes.",27,Tomato Kiwi
Andrew Streets,39,male,48,High School,Media Science,engineering,databases,14,download3.jpg,34_personality.png,Efficient and a teamplayer,random is a a words cool hello is of banana ,banana hello random this this a selection a random is cool banana hello random random random yay words banana cool ,Native,6.651313226227355,"Skills: powerpoint, communication and analytics","I grew up in a lower-income family with a single mother who worked three jobs to provide for my brothers and me. My mother taught me the value of hard work and the importance of taking care of others who cannot take care of themselves. She also stressed the importance of education to us, teaching us that it would help us access an easier life. Her encouragement along with my own determination helped me earn some of the best grades in my high school class.",73,Coral Kiwi
Darrin Johnson,22,male,77,Masters,Journalist,engineering,software programming,2,download2.jpg,33_personality.png,Creative and solution-minded,cool a banana yay random this random banana is of ,words a banana banana this selection words a a this this selection words words this of a random yay is ,Native,7.245441365613025,"Skills: statistics, management and java","I hope to become a web designer, so I would like to learn more about multimedia design. I feel your course would help me understand the digital design process and the way websites and their visual imagery can help businesses present images to consumers.",67,Black Citrus
Kelsey Jenkins,39,female,56,Ph.d.,Computer Scientist,arts,databases,23,download.jpg,14_personality.png,Great with tech,hello selection words this yay cool hello yay words a ,cool hello this hello is this words yay hello selection words cool cool yay of of hello hello cool is ,Professional,1.1159334427911871,"Skills: java, communication and analytics","Studying at your school would help me develop my aptitude for design while having fun, whether it is on the sporting field or in another arena. I am open to whatever experiences life at Seattle University would bring me and hope I could achieve them through your multimedia design and communication degree. Thank you very much for considering my request",74,Coffee Plum
James Cassady,54,male,18,Bachelor,Software Engineer,sciences,service industry,12,download3.jpg,28_personality.png,Great with tech,cool yay words of random is banana random yay words ,random of yay hello this hello selection words selection this cool of selection selection this words is of random a ,Advanced,2.4904776456449773,"Skills: statistics, management and excel","I hope to become a web designer, so I would like to learn more about multimedia design. I feel your course would help me understand the digital design process and the way websites and their visual imagery can help businesses present images to consumers.",72,Sienna Raisin
Dawn Langworthy,56,female,14,Postdoc,Software Engineer,arts,software programming,8,download.jpg,11_personality.png,Great with tech,selection banana words random hello hello selection banana cool banana ,selection hello hello this a is selection words selection a banana is cool random of of yay banana this random ,Native,3.2806795239798614,"Skills: java, management and juristics","I hope to become a web designer, so I would like to learn more about multimedia design. I feel your course would help me understand the digital design process and the way websites and their visual imagery can help businesses present images to consumers.",42,Beige Mango
Georgia Gould,22,female,69,Ph.d.,Media Science,arts,databases,22,download1.jpg,45_personality.png,Efficient and a teamplayer,is words a words words selection cool words of yay ,a of hello hello a of is yay words hello is of a cool random of hello a words hello ,Limited,9.428753459829203,"Skills: java, powerpoint and management",I love the way different colors and images can evoke emotions in viewers. I enjoy experimenting with the power of color and imagery and think I have a natural creative flair. I am confident that I will be able to apply this flair to new projects and increase my design abilities at your school.,4,Avocado Plum
